{
  "versao_contrato": "1.0.0",
  "modelo": "Lee-Carter",
  "passo_origem": 6,
  "status": "APROVADO",
  "rodada": {
    "id": "20261006T125901Z",
    "data_hora_utc": "2026-10-06T12:59:01+00:00",
    "commit": "c1b08deb0123e22b9d212b434c901845d110ef1b",
    "commit_com_alteracoes_locais": false,
    "versoes": {
      "python": "3.12.3",
      "numpy": "2.5.3",
      "pandas": "3.0.6",
      "matplotlib": "3.11.2",
      "PyALE": "1.2.0",
      "jsonschema": "4.26.0"
    },
    "tempo_execucao_s": 1.069
  },
  "parametros": {
    "idades": [
      20,
      21,
      22,
      23,
      24,
      25,
      26,
      27,
      28,
      29,
      30,
      31,
      32,
      33,
      34,
      35,
      36,
      37,
      38,
      39,
      40,
      41,
      42,
      43,
      44,
      45,
      46,
      47,
      48,
      49,
      50,
      51,
      52,
      53,
      54,
      55,
      56,
      57,
      58,
      59,
      60,
      61,
      62,
      63,
      64,
      65,
      66,
      67,
      68,
      69,
      70
    ],
    "anos_historicos": [
      2015,
      2016,
      2017,
      2018,
      2019,
      2020,
      2021,
      2022,
      2023,
      2024
    ],
    "anos_analisados": [
      2015,
      2054
    ],
    "alpha_x": [
      -6.607033011791289,
      -6.546464077120605,
      -6.5089353499098594,
      -6.491454228456139,
      -6.486661344317002,
      -6.486939035794279,
      -6.485173036934486,
      -6.478622590189161,
      -6.463706884326631,
      -6.442472827974896,
      -6.419201893123291,
      -6.395840308054194,
      -6.369880296508512,
      -6.341088968578022,
      -6.308502168388717,
      -6.270798560102064,
      -6.227740534217726,
      -6.180116755854026,
      -6.1283000968849874,
      -6.072612728403337,
      -6.014125166714635,
      -5.9525213684928815,
      -5.886932477801301,
      -5.817549649926138,
      -5.745683368151945,
      -5.672783309399525,
      -5.5998655162905395,
      -5.5270595477245426,
      -5.454617989807836,
      -5.382224096507807,
      -5.309162249437344,
      -5.235411585119026,
      -5.161553694846391,
      -5.087750888956732,
      -5.013995594744223,
      -4.939706474993523,
      -4.86553777130679,
      -4.792759594897284,
      -4.7213806940404845,
      -4.650319508107372,
      -4.578296341293987,
      -4.503792823574946,
      -4.426122804848831,
      -4.34507597902566,
      -4.261643192575227,
      -4.178476444270826,
      -4.096058552936071,
      -4.013645645908344,
      -3.9311576569655307,
      -3.8489961292815935,
      -3.767935878856524
    ],
    "beta_x": [
      0.024626488404149084,
      0.02467452144819169,
      0.024501010872532154,
      0.02409313655084323,
      0.02353310313437494,
      0.022898105005743116,
      0.022325850818159864,
      0.02202256536140638,
      0.022005728435955572,
      0.02229333865792955,
      0.02281058078281609,
      0.02336706611716746,
      0.023688587653218785,
      0.023600991660297173,
      0.0231169874473484,
      0.022296669256999302,
      0.021290764020712644,
      0.020207315397778747,
      0.019212444196261887,
      0.018366848267022225,
      0.01774983133412261,
      0.01747003142710201,
      0.017597168020277026,
      0.018131632916526082,
      0.018923269926446818,
      0.01975923810147008,
      0.02040224448029793,
      0.020622940652753993,
      0.02035798509113843,
      0.019631725209098363,
      0.018625978397559875,
      0.017618210534923576,
      0.01686043960747442,
      0.016520216907829503,
      0.016597815482832828,
      0.017005927376708523,
      0.01755452059516409,
      0.01799950417096088,
      0.01820007648823544,
      0.018105509703005458,
      0.0177071328716424,
      0.017132093861775926,
      0.01653927113988766,
      0.01605755864969834,
      0.015733771524683273,
      0.015628304510833944,
      0.015756069553411033,
      0.016145708029750197,
      0.016757671123978076,
      0.017528572840142316,
      0.01834747598136054
    ],
    "kappa_t": [
      3.1021173758708245,
      2.0503101130286456,
      0.9366675974381204,
      -0.06890710662291302,
      -1.0765658779540441,
      -2.0340729801215915,
      -3.032085335972652,
      3.2416333948429985,
      -1.044683945488857,
      -2.074413235020531
    ],
    "drift": -0.5751700678768172,
    "variancia_explicada": 0.7635168270353088,
    "origem_dados": "Passo 1 — IBGE real, série histórica (serie_historica_qx.csv, 2015-2024)"
  },
  "plausibilidade": [
    {
      "nome": "estrutura_consistente",
      "aprovado": true,
      "detalhe": "Tamanhos de alpha_x, beta_x e kappa_t batem com idades e anos; idades crescentes; anos consecutivos. Sem problemas."
    },
    {
      "nome": "valores_finitos",
      "aprovado": true,
      "detalhe": "Parâmetros e q(x,t) sem NaN nem infinito; q(x,t) entre 0.000839 e 0.024217."
    },
    {
      "nome": "q_cresce_com_idade",
      "aprovado": true,
      "detalhe": "A partir de 30 anos, em todos os anos analisados. Sem exceções."
    },
    {
      "nome": "kappa_em_queda",
      "aprovado": true,
      "detalhe": "drift = -0.5752; inclinação da reta de kappa_t = -0.4035 (as duas devem ser negativas: mortalidade caindo)."
    },
    {
      "nome": "restricoes_canonicas",
      "aprovado": true,
      "detalhe": "soma(beta_x) = 1.000000 (deve ser 1); média(kappa_t) = 0.000000 (deve ser 0)."
    }
  ],
  "alertas": [
    {
      "tipo": "salto_kappa",
      "detalhe": "kappa_t variou +6.274 de 2021 para 2022 (limite 1.726 = 3 x |drift|). Possível quebra na série de dados de origem; projeções que usam esses anos podem estar distorcidas."
    },
    {
      "tipo": "salto_kappa",
      "detalhe": "kappa_t variou -4.286 de 2022 para 2023 (limite 1.726 = 3 x |drift|). Possível quebra na série de dados de origem; projeções que usam esses anos podem estar distorcidas."
    },
    {
      "tipo": "drift_sensivel_aos_extremos",
      "detalhe": "O drift do Passo 6 usa só o primeiro e o último ano (-0.5752); a reta ajustada a todos os anos dá -0.4035. Diferença acima de 25%: a projeção depende muito dos anos das pontas."
    },
    {
      "tipo": "corcova_de_acidentes",
      "detalhe": "7 casos de q(x,t) que não crescem com a idade abaixo de 30 anos. Comportamento esperado (mortes por causas externas em adultos jovens); fora da checagem de monotonia."
    }
  ],
  "ale": {
    "idade": [
      {
        "valor": 20.0,
        "efeito": -0.004022215368395624
      },
      {
        "valor": 22.0,
        "efeito": -0.0039061207461440904
      },
      {
        "valor": 25.0,
        "efeito": -0.0038640275308807403
      },
      {
        "valor": 27.0,
        "efeito": -0.003845161725654531
      },
      {
        "valor": 30.0,
        "efeito": -0.003773902601392268
      },
      {
        "valor": 32.0,
        "efeito": -0.0037140684102212112
      },
      {
        "valor": 35.0,
        "efeito": -0.0035498357551878084
      },
      {
        "valor": 37.0,
        "efeito": -0.0033722946822726837
      },
      {
        "valor": 40.0,
        "efeito": -0.003015287230374492
      },
      {
        "valor": 42.0,
        "efeito": -0.0027249008211444664
      },
      {
        "valor": 45.0,
        "efeito": -0.0021971183236396854
      },
      {
        "valor": 48.0,
        "efeito": -0.0014975045145114276
      },
      {
        "valor": 50.0,
        "efeito": -0.0008743203442630578
      },
      {
        "valor": 53.0,
        "efeito": 0.00026410455691461276
      },
      {
        "valor": 55.0,
        "efeito": 0.0011006164116868222
      },
      {
        "valor": 58.0,
        "efeito": 0.0025480026465315633
      },
      {
        "valor": 60.0,
        "efeito": 0.003757703582564678
      },
      {
        "valor": 63.0,
        "efeito": 0.006220593454995807
      },
      {
        "valor": 65.0,
        "efeito": 0.008309165381443617
      },
      {
        "valor": 68.0,
        "efeito": 0.01190443347787608
      },
      {
        "valor": 70.0,
        "efeito": 0.014659750521668577
      }
    ],
    "ano": [
      {
        "valor": 2015.0,
        "efeito": 0.0010974864537470117
      },
      {
        "valor": 2016.0,
        "efeito": 0.0009785294978937337
      },
      {
        "valor": 2018.0,
        "efeito": 0.0007455314676229462
      },
      {
        "valor": 2020.0,
        "efeito": 0.0005372086122265341
      },
      {
        "valor": 2022.0,
        "efeito": 0.0011134339179541505
      },
      {
        "valor": 2024.0,
        "efeito": 0.0005330083179561603
      },
      {
        "valor": 2026.0,
        "efeito": 0.0004144970048681083
      },
      {
        "valor": 2028.0,
        "efeito": 0.0002983941315647307
      },
      {
        "valor": 2030.0,
        "efeito": 0.00018465045466595448
      },
      {
        "valor": 2032.0,
        "efeito": 7.32177382746209e-05
      },
      {
        "valor": 2034.0,
        "efeito": -3.59512664022941e-05
      },
      {
        "valor": 2036.0,
        "efeito": -0.0001429028410356763
      },
      {
        "valor": 2038.0,
        "efeito": -0.00024768231976648775
      },
      {
        "valor": 2040.0,
        "efeito": -0.0003503341084150017
      },
      {
        "valor": 2042.0,
        "efeito": -0.00045090170331370835
      },
      {
        "valor": 2044.0,
        "efeito": -0.0005494277097709262
      },
      {
        "valor": 2046.0,
        "efeito": -0.0006459538601714275
      },
      {
        "valor": 2048.0,
        "efeito": -0.000740521031720593
      },
      {
        "valor": 2050.0,
        "efeito": -0.0008331692638388535
      },
      {
        "valor": 2052.0,
        "efeito": -0.0009239377752123462
      },
      {
        "valor": 2054.0,
        "efeito": -0.0010128649805062522
      }
    ]
  },
  "shap": {
    "valor_base": 0.0061040855934220975,
    "importancia_media_abs": {